49,pens,Sharpie,Paper Mate,BiC,Office Products,Home,Tools,B082PN4X5J,"Sharpie S-Gel Gel Pens, Black Barrel, Medium Point (0.7mm), Black Gel Ink Pens, 12 Count - Home, Office, School, Journaling, Writing, Note-Taking, Teacher Supplies",11.98,13.37,B0C9W8DD9S,"Ddaowanx Gel Pens, 6 Pcs 0.5mm Quick Dry Black Ink Pens Fine Point Smooth Writing Pens, Cute Office School Supplies Gifts for Women",7.19,4.21,B019QBOG3U,Paper Mate Colorful Gel Pens - InkJoy Gel Pens Assorted Medium Point (0.7). Perfect for Vibrant Colored Writing and Sketching with Paper Mate InkJoy 14 Count,5.57,3.05,2025/8/10
50,iphone 16 pro case,SUPFINE,Otterbox,CAPRARO,Wireless,Electronics,Kitchen,B0DPMMMLP7,"SUPFINE Magnetic for iPhone 16 Pro Case (Compatible with MagSafe) (Military Grade Drop Protection) Translucent Matte Shockproof with Anti-Fingerprint Phone Cover,Black",10.97,7.71,B0DB1TDQ9S,FNTCASE for iPhone 16 Pro Case: iPhone 16 Pro Phone Clear Case Magnetic Military Grade Drop Protection Anti Yellowing Cell Phone Cover - Rugged Shockproof Protective Bumper Transparent Cases(Clear),4.37,3.26,B0D8B5SH38,"ORNARTO Compatible with iPhone 16 Pro Case 6.3"", Slim Liquid Silicone 3 Layers Soft Gel Rubber Shockproof Protective Case with Anti-Scratch Microfiber Lining-Chalk Pink",3.8,1.47,2025/8/10
51,wicked,,Mattel,William Morrow,Digital_Video_Download,Toys,Digital_Music_Purchase,B0DH16WXFD,Wicked - Bonus X-Ray Edition,83.97,0,B0DGZV9Z5Z,Wicked - Bonus X-Ray Edition,7.67,0,B0B6RWRZNP,Wicked,0.69,0,2025/8/10
52,creatine,Nutricost,ON,THORNE,Health & Personal Care,Grocery,Digital_Ebook_Purchase,B00GL2HMES,"Nutricost Creatine Monohydrate Micronized Powder 500G, 5000mg Per Serv (5g) - 100 Servings, 17.9 Oz",17.54,14.06,B002DYIZEO,"Optimum Nutrition Micronized Creatine Monohydrate Powder, Unflavored, 120 Servings, 600 Grams (Packaging May Vary)",9.14,6.72,B07978VPPH,"THORNE Creatine - Micronized Creatine Monohydrate Powder, Amino Acid Support for Muscles, Cellular Energy & Cognitive Function* - Unflavored - NSF Certified for Sport - 5 g per Serving - 90 Servings",5.88,5.23,2025/8/10
53,tattoo cover up makeup waterproof,WOPLAGYREAT,Yakitoko,COPEAKY,Beauty,Video DVD,Biss,B0FD7KJL7T,"Tattoo Cover Up Makeup Waterproof, 2 Colors Body Concealer for Tattoo, Dark Spots, Scars, Vitiligo",43.37,0,B0FCLXYKG4,"Tattoo Cover Up, Tattoo Cover Up Makeup Waterproof Sweatproof, Suitable for Tattoos, Scars, Spots & Vitiligo, Invisible & Natural, Skin-Friendly, 2 Colors",24.15,0,B0F2FM7QGD,"Full Coverage Tattoo Cover Up Makeup – Waterproof & Sweatproof Concealer for Scars, Vitiligo, Dark Spots – Long-Lasting, Natural Finish for Body & Legs (2 Colors)",19.59,0,2025/8/10
54,apple watch bands,AMSKY,SuperNaNa,Fullmosa,Wireless,Electronics,Watches,B0B2ZYHJKP,"6 Pack Sport Bands Compatible with Apple Watch Band 38mm 40mm 41mm 42mm 44mm 45mm 49mm 46mm,Silicone Waterproof Strap Compatible with iWatch Apple Watch Series 10 9 Ultra 8 7 6 5 4 3 2 1 SE Women Men",6.48,2.78,B07F1RRQXQ,"Fullmosa Compatible Apple Watch Bands 45mm 44mm 42mm 46mm 49mm 41mm 40mm 38mm, Metal iWatch Band with Case for Apple Watch Series 9 8 7 6 5 4 3 2 1 SE 10 Ultra, 42mm 44mm 45mm Black",4.75,1.2,B0CTH4VRZF,"10 Pack Stretchy Bands Compatible with Apple Watch Band 40mm 38mm 41mm 42mm 44mm 45mm 46mm 49mm Women Men, Water-Resistant Solo Loop Elastic Sport Straps for iWatch Series 10 9 8 7 6 5 4 3 SE Ultra",3.21,2.05,2025/8/10
55,vanity,LIVELYGLOW,YESHOMY,T4TREAM,Furniture,Home,Beauty,B0CTTXQ51V,"YESHOMY Vanity Desk with Mirror, Power Outlet and 10 Lights, Makeup Table with 7 Drawers, 3 Color Modes Available for Bedroom, Pure White",4.69,0.4,B0DHZK79JH,"HUAHUU Vanity Desk with Mirror and Lights, Makeup Vanity Desk with Lights 3 Colors, Transparent Top Vanity with 2 RGB Drawers, 6 Shelves, Large Tempered Cabinet, Power Outlet, for Bedroom, White",3.37,1.19,B0CDP2FQJ8,"Quimoo Large Vanity Desk with LED Lighted Mirror & Power Outlet,Makeup Vanity Table with 7 Drawers,4 Shelves and 5 Hooks,Vanity Table, Vanity Desk Set for Bedroom,Bathroom,White",2.65,0.79,2025/8/10
56,composition notebook,Mead,Rosmonde,Oxford,Office Products,Books,Toys,B071NRXVBP,"Mead Composition Notebook, 3 Pack, Wide Ruled Paper, 7-1/2"" x 9-3/4"", 100 Sheets per Comp Book, Black Marble (38301)",25.69,27.83,B0BYGD1L2N,"C-Line Composition Notebook, Wide Ruled, Marble Cover, 1 Notebook, Color May Vary (22010)",7.52,4.41,B0CN3SKN8M,"Mead Composition Notebook, 6 Pack, Wide Ruled Paper, 7-1/2"" x 9-3/4"", 100 Sheets per Comp Book, Assorted Colors (950054-ECM)",5.68,5.09,2025/8/10
57,aaa batteries,Amazon Basics,Duracell,Energizer,Health & Personal Care,Electronics,Biss,B00NTCHCU2,"Amazon Basics AAA Alkaline High-Performance Batteries, 1.5 Volt, 10-Year Shelf Life, 20 count (Pack of 1)",29.16,23.24,B00LH3DMUO,"Amazon Basics AAA Alkaline High-Performance Batteries, 1.5 Volt, 10-Year Shelf Life, 36 Count (Pack of 1)",14.69,13.15,B004K95PBQ,"Duracell Coppertop AAA Batteries with Power Boost Ingredients, 24 Count Pack Triple A Battery with Long-Lasting Power, Alkaline AAA Battery for Household and Office Devices",6.26,6.03,2025/8/10
58,dresser,WLIVE,OLIXIS,Sweetcrispy,Furniture,Home,Baby,B0DL64N5NZ,"OLIXIS Dresser for Bedroom, 7 Storage Drawers, Wide Fabric Closet Chests Organizer Tower Furniture, TV Stand with Wooden Top Metal Frame for Clothes, Living Room, Hallway, Entryway, Classic White",7.34,4.84,B095PF22B8,"WLIVE 9-Drawer Dresser, Fabric Storage Tower for Bedroom, Hallway, Entryway, Closet, Tall Chest Organizer Unit with Fabric Bins, Steel Frame, Wood Top, Easy Pull Handle, Rustic Brown Wood Grain Print",4.82,2.81,B0CQ1QWY35,"Sweetcrispy Dresser, Dresser for Bedroom Drawer Organizer Storage Drawers, Fabric Storage Tower with 8 Drawers, Chest of Drawers with Steel Frame, Wood Top for Nursery, Living Room, Closet",3.45,1.72,2025/8/10
59,medicube,medicube,TOSOWOONG,BIODANCE,Beauty,Health & Personal Care,Luxury_Beauty,B09V7Z4TJG,"Medicube Zero Pore Pads 2.0, Dual-Textured Facial Toner Pads for Exfoliation and Pore Care with 4.5% AHA Lactic Acid & 0.45% BHA Salicylic Acid, Ideal for All Skin Types, Korean Skin Care (70 units)",21.89,22.44,B0DGTMR754,"medicube Salmon DNA PDRN pink collagen jelly gel mask | overnight face mask for glass glow skin- elasticity, hydrating, firming and moisturizing | korean skincare, 28g, 4ea",8.88,8.18,B0BRMYHMS5,"medicube Collagen Overnight Wrapping Peel Off Facial Mask Pack - Elasticity & Hydration Care, Reduces Sagging & Dullness - Hydrolyzed Collagen For Glowing Skin - Korean Skin Care, 2.53 fl.oz",7.47,5.61,2025/8/10
60,nintendo switch 2,Nintendo,MUMBA,CoBak,Video Games,PC,Digital_Video_Games,B0FC5FJZ9Z,Nintendo Switch 2 + Mario Kart World Bundle,56.24,30.64,B0F3GWXLTS,Nintendo Switch 2 System,14.49,0.58,B0BFJWCYTL,Nintendo Switch™ with Neon Blue and Neon Red Joy‑Con™,8.62,10.4,2025/8/10
61,lego,LEGO,,Kravkind,Toys,Digital_Video_Download,Home,B0DX3J6MT7,"LEGO Super Mario Game Boy - Retro Building Sets for Adults, Ages 18+ - Collectible Model with Game Paks and Display Stand - Birthday Gifts for Men & Women - 72046",8.72,1.47,B00NHQFA1I,"LEGO Classic Medium Creative Brick Box 10696 Building Toy Set - Featuring Storage, Includes Train, Car, and a Tiger Figure, and Playset for Kids, Boys, and Girls Ages 4-99",4.8,5.44,B0DRW6C2RF,"LEGO Botanicals Happy Plants Building Toys - Bedroom or Dorm Room Decor for Girls, Boys, & Adults, Desk or Shelf Display - Birthday Gift Ideas for Kids, Ages 9+ - 10349",3.84,3.74,2025/8/10
62,portable charger,charmast,VRURC,INIU,Wireless,Electronics,Lawn and Garden,B0CY2JJ4WS,"Portable Charger with Built in Cables, Portable Charger with Cords Wires Slim 10000mAh Travel Essentials Battery Pack 6 Outputs 3A High Speed Power Bank for iPhone Samsung Pixel LG Moto iPad",10.27,7.59,B07CZDXDG8,"INIU Portable Charger, Slimmest 10000mAh 5V/3A Power Bank, USB C in&out High-Speed Charging Battery Pack, External Phone Powerbank Compatible with iPhone 16 15 14 13 12 Samsung S22 S21 Google iPad etc",8.16,6.39,B0BL7P8K16,"VRURC Portable Charger Power Bank, 10000mAh Travel Essentials Battery Pack, 5 Outputs 2 Inputs Slim Charging Bank Built-in Cables Cords Wires Compatible with iPhone,Samsung,Android-Pink(1 Pack)",3.92,1.49,2025/8/10
63,queen bed frame,NEW JETO,Allewie,Fluest,Furniture,Home,Kitchen,B0B8VQLN6Y,"NEW JETO Metal Bed Frame,Queen Size Bed Frame with Storage Space,Heavy Duty Sturdy Mattress Foundation,Easy Assembly,No Box Spring Needed, Black,14 Inch,Queen",12.14,15.63,B0CKQSJ333,"Lifezone Queen Bed Frame with 2-Tier Storage Headboard, Metal Platform Bed Frame with 4 Storage Drawers, Built in Charging Station & LED, Noise-Free/Metal Support/No Box Spring Needed, Vintage Brown",3.19,0.59,B0CGKPHL7D,"Fluest Queen Bed Frame with Headboard and Footboard, with Under Bed Storage, All-Metal Support System, No Box Spring Needed, Easy Assembly,Rustic Brown",2.81,1.93,2025/8/10
64,mechanical pencil,BiC,Paper Mate,Four Candies,Office Products,Toys,Home,B001CD9RRG,"BIC Xtra Strong Mechanical Pencils with Erasers, Thick Point (0.9mm), 24-Count, Mechanical Pencils for School or Office Supplies",17.6,19.06,B09QXWMDZ8,"Paper Mate Clearpoint Mechanical Pencils, 0.7mm HB #2 Pencil Lead, 2 Pencils, Assorted Barrel Colors, 10 Count - Back to School,Teacher Supplies, Drawing, Sketching",7.78,6.4,B089TYRM7Q,"Bic Mechanical Pencil #2 EXTRA SMOOTH, 40 Pack Of Twenty 0.5mm, and Twenty 0.7 mm - Assorted Colored Barrels - Variety Pack of Bic Lead Pencils",5.97,3.15,2025/8/10
65,weapons,,WB,Umarex,Digital_Video_Download,Sports,Video DVD,B0FG67CL7J,Weapons,81.46,0,B0FG63B6FK,Weapons,14.34,0,B0FG6ML111,Weapons,1.96,0,2025/8/10
66,patio deals,wudipatio,Fussion,Devoko,Lawn and Garden,Furniture,Home Improvement,B0DK9Q7P1T,"wudipatio 6 Pieces Outdoor Patio Furniture Sets with Furniture Cover, PE Rattan Wicker Patio Conversation Set with Tea Table (Peacock Blue, Rattan Storage Table)",7.61,3.46,B0DFCGDVCK,"4 Pack 10Ft String Light Poles for Outside, Thickened Metal Lights Hanger Pole Outdoor with Fork, Lighting Hanging Post Accessories for Patio Decor Garden Backyard Yard Front Porch Outside Decorations",6.75,2.08,B07DJ6J6GD,Flamaker 3 Pieces Patio Set Outdoor Wicker Furniture Sets Modern Rattan Chair Conversation Sets with Coffee Table for Yard and Bistro (Black),2.86,0.35,2025/8/10
67,hangers,Amazon Basics,Utopia Home,HOUSE DAY,Home,Biss,Home Improvement,B06X421WJ6,Utopia Home - Plastic Hangers 50 Pack - Space Saving Clothes Hanger - Durable and Strong Closet Organizers and Storage Makes It Ideal Apartment or Dorm Room Essentials for Girls or Guys (White),11.35,9.37,B00FXNAAW2,"Amazon Basics Slim, Velvet, Non-Slip Suit Clothes Hangers, Pack of 50, Black",10.24,8.36,B09GS2ZJDM,"Amazon Basics Slim Velvet, Non-Slip Suit Clothes Hangers, Pack of 50, Navy Blue/Rose Gold",9.22,1.35,2025/8/10
68,ballard,,National Geographic,"Little, Brown",Digital_Video_Download,Video DVD,Biss,B0F589BQ9F,Ballard,33.21,,B0F55JM7MS,Ballard - Season 1,20.22,,B0F9TV7TYX,Library of Lost Souls,14.82,,2025/8/10
69,rice cooker,AROMA,CUCKOO,COMFEE',Kitchen,Home,Biss,B007WQ9YNO,"AROMA Digital Rice Cooker, 4-Cup (Uncooked) / 8-Cup (Cooked), Steamer, Grain Cooker, Multicooker, 2 Qt, Stainless Steel Exterior, ARC-914SBD",19.58,16.35,B0979TYRYN,"Aroma Housewares 4-Cups (Cooked) / 1Qt. Rice & Grain Cooker (ARC-302NG), White",10.77,9.37,B00N9N6GOY,"Aroma Housewares Aroma 6-cup (cooked) 1.5 Qt. One Touch Rice Cooker, White (ARC-363NG), 6 cup cooked/ 3 cup uncook/ 1.5 Qt.",8.93,4.41,2025/8/10
70,colored pencils,Crayola,Amazon Basics,KALOUR,Toys,Office Products,Home,B00006RVTS,"Crayola Colored Pencils (36ct), Kids Pencil Set, Back to School Essentials, Must Have Classroom Supplies for Kids, Pre-Sharpened Coloring Book Pencils, 3+",36.35,41.25,B07D93R5HV,"Amazon Basics Colored Pencils for Coloring and Drawing, Premium, Soft Core, Back to School Supplies, 24 Count (Pack of 1), Multicolor",13.14,11.59,B0002HYYHG,Crayola Colouring Pencils - Assorted Colours (Pack of 12) | A Must-Have for All Kids Arts & Crafts Sets | Ideal for Kids Aged 3+,6.9,3.97,2025/8/10
71,airtag,Apple,ANNNWZZD,BowenBo,Wireless,Pet Products,Electronics,B0CWXNS552,"Apple AirTag. Keep Track of and find Your Keys, Wallet, Luggage, Backpack, and More. Simple one-tap Set up with iPhone or iPad",51.47,51.34,B0D54JZTHY,"Apple AirTag 4 Pack. Keep Track of and find Your Keys, Wallet, Luggage, Backpack, and More. Simple one-tap Set up with iPhone or iPad",24.04,24.63,B0FCBL6NB8,"ANNNWZZD Air-Tag 4 Pack Item Finders with Apple Find My APP (iOS Only) Air Tags Help You Track Your Keys, Wallet, Luggage, Backpack, Super Lightweight, Comes with 4 Beautiful Keyrings",3.35,1.56,2025/8/10
72,air purifier,Levoit,FULMINARE,MOOKA,Home,Kitchen,Biss,B09GTRVJQM,"LEVOIT Air Purifiers for Bedroom Home, 3-in-1 Filter Cleaner with Fragrance Sponge for Better Sleep, Filters Smoke, Allergies, Pet Dander, Odor, Dust, Office, Desktop, Portable, Core Mini-P, White",20.33,14.54,B07VVK39F7,"LEVOIT Air Purifier for Home Allergies Pet Hair in Bedroom, Covers Up to 1073 ft² by 56W High Torque Motor, AHAM VERIFIDE, 3-in-1 Filter with HEPA Sleep Mode, Remove Dust Smoke Odor, Core300-P, White",12.34,6.34,B0B4ZSKPNL,"Air Purifiers for Bedroom, FULMINARE H13 True HEPA Air Filter, Quiet Air Cleaner With Night Light,Portable Small Air Purifier for Home, Office, Living Room",7.22,6.07,2025/8/10
72,transformers,,TRANSFORMERS,AMAZON PRIME VIDEO,Digital_Video_Download,Toys,Books,B00BTO5THK,Transformers,24.82,0,B00BTO5UBU,Transformers: Revenge of the Fallen,13.17,0,B0D6JSXGFW,Transformers: Dark of the Moon,12.26,0,2025/8/10
74,pimple patches,Mighty Patch,Peach Slices,Daolyo,Beauty,Health & Personal Care,Luxury_Beauty,B074PVTPBW,Mighty Patch™ Original patch from Hero Cosmetics – The #1 Hydrocolloid Acne Pimple Patch for Shrinking Zits and Whiteheads in 1 use; Nighttime Spot Stickers for Face and Skin (36 Count),18.55,17.27,B0CCRWC6W9,"Daolyo Pimple Patches for Face, 4 Size 300 Counts Acne Patches, Hydrocolloid Patches for Covering Zits and Blemishes, Spot Stickers with Salicylic Acid, Tea Tree Oil & Calendula Oil",10.63,9.07,B07FPT52DY,"Peach Slices | Acne Spot Dots | Hydrocolloid Acne Patches | For Zits, Blemishes, & Breakouts | Vegan | Cruelty-Free | Pimple Patches | Facial Skin Care Products | 3 Sizes (7mm, 10mm, & 12mm) | 30 Ct",9.3,6.29,2025/8/10
75,bread,Nature's Own,Dave's Killer Bread,365 BY WHOLE FOODS MARKET,Fresh_Perishable,Grocery,Digital_Music_Purchase,B000LR4XJ6,"Nature's Own Honey Wheat, Honey Wheat Sandwich Bread, 20 oz Loaf",6.73,5.9,B0049W8JHQ,"Nature's Own Butterbread, Sliced White Bread, 20 oz Loaf",5.35,4.68,B0071JHNWG,"Dave's Killer Bread 21 Whole Grains & Seeds Thin-Sliced, Whole Grain Organic Bread, 20.5 oz Loaf",5.13,4.39,2025/8/10
76,milk,365 BY WHOLE FOODS MARKET,Amazon Grocery,Organic Valley,Fresh_Perishable,Grocery,Health & Personal Care,B0BRBBX5B5,"Organic Valley, Grassmilk Whole Organic, 64 Ounce",3.23,3.09,B000O6K8TI,"Organic Valley, Organic Whole Milk, 64 Oz (Half Gallon)",3.22,2.86,B0D6TFZBF8,"Amazon Grocery, Whole Milk, 1 Gallon, 128 Fl Oz",3.15,2.22,2025/8/10
77,blackout curtains,NICETOWN,Joydeco,100% Blackout Shield,Home,Home Improvement,Camera,B01CS31R94,"NICETOWN Halloween Pitch Black Solid Thermal Insulated Grommet Blackout Curtains/Drapes for Bedroom Window (2 Panels, 42 inches Wide by 63 inches Long, Black)",13.9,5.75,B0BR3STN87,"100% Blackout Shield Linen Blackout Curtains for Bedroom 84 Inches Long, Back Tab/Rod Pocket Living Room Drapes, Thermal Insulated Blackout Curtains 2 Panels Set, 50"" W x 84"" L, Cream",12.82,4.1,B09228LT3G,"Joydeco 84 Inch Blackout Curtains for Bedroom - Thermal Insulated Room Darkening Light Blocking Curtains with Grommets, Noise Reducing & Wrinkle-Free Drapes for Living Room Windows, 2 Panels",7.91,2.88,2025/8/10
78,shower caddy,EUDELE,YASONIC,Veken,Home,Furniture,Biss,B0BLSCY6PR,"EUDELE Adhesive Shower Caddy, 5 Pack Rustproof Stainless Steel Bath Organizers With Large Capacity, No Drilling Shelves for Bathroom Storage & Home Decor-XL Size",13.15,9.34,B09SZ9T4MV,"Eudele Mesh Shower Caddy Portable for College Dorm Room Essentials, 8-Pocket Large Capacity Shower Bag for Beach, Swimming, Gym",9.68,6.87,B09MFDXZHJ,"Moforoco Shower Caddy Shelf Organizer Rack, Self Adhesive Black Bathroom Shelves Basket, Home Farmhouse Wall Inside Organization and Storage Decor Rv Accessories, First Camper Apartment Essentials",4.64,4.94,2025/8/10
79,travel essentials,Tocelffe,Taygeer,Temdan,Luggage,Home,Beauty,B0BZWMJM2F,"18pack Travel Bottles for Toiletries,TSA Approved Silicone Travel Containers for Toiletries,Leak Proof Refillable Liqus Shampoo And Conditioner travel Essentials toiletry Bottles",6.65,2.85,B09MQWWP87,"Taygeer Travel Backpack for Women, Carry On Backpack with USB Charging Port & Shoe Pouch, TSA 15.6inch Laptop Mochila Flight Approved, Nurse Bag Casual Daypack for Weekender Business Hiking, Pink",6.34,1.32,B0DHYJ9CGH,"Temdan for Travel Essentials,3 in 2 USB C Cable for Apple Watch Charger/iPhone 16 Charger/Lightning,Multi Charging Cable Cord,Camping Essentials,Portable Designed for iWatch Series &iPhone 16-12-4FT",4.29,0.81,2025/8/10
80,lash clusters,Pawotence,Goddvenus,ALICE,Beauty,Biss,Guild,B0C74B6XN8,"Pawotence Lash Extension Kit DIY 280pcs Lash Clusters Eyelash Extension Kit, 9-16mm 30D 40D Individual Lashes Kit with Lash Bond and Seal, Lash Tweezers for Self Use (30D&40D, 0.07D, 9-16mm, Kit)",8.91,4.33,B0DK8DCVK7,Goddvenus Lash Clusters Kit Wispy Eyelash Clusters Lashes Natural DIY Lash Extension Kit 10-16mm Cluster Eyelash Extensions Kit 300pcs C Curl Individual Lashes Cluster Eyelash (No Tweezers),8.4,3.57,B0DM8ZT4PF,Lash Clusters 100D Long 12-20mm Lash Spikes Eyelash Clusters Volume Individual Lashes DIY Spiky Lash Extension Mega Cluster Eyelash Extensions Mink Strips Lashes Thick by CORUSCATE,3.02,1.32,2025/8/10
81,pencils,Amazon Basics,Ticonderoga,BiC,Office Products,Toys,Home,B071JM699B,"Amazon Basics Woodcased Classroom 2 Pencils with Erasers, Pre-sharpened, HB Lead, Value Pack of 30 count, Orange",26.47,25.97,B006CSPZK4,"Ticonderoga Wood-Cased Pencils, Pre-Sharpened, #2 HB Soft, Yellow, 30 Count",13.49,12.97,B071JM699P,"Amazon Basics Wood-Cased #2 Pencils, Pre-sharpened, HB Lead Bulk Box, 150 Count, Yellow",7.91,6.81,2025/8/10
82,magnesium complex,Toplux,Clean Nutraceuticals,Nature Made,Health & Personal Care,Grocery,Beauty,B0CRY2SVPV,"Magnesium Complex Supplement 8 Elemental 1000mg - Magnesium Glycinate, Citrate, Malate, Taurate, Chelated for Easy Absorption for Bones, Muscle, Recovery, Energy, Vegan Non-GMO 90 Capsules",34.2,27.46,B0BVXYD59M,"Clean Nutraceuticals Magnesium Complex with Magnesium Glycinate Citrate Malate Oxide Taurate Aspartate Orotate & Mag Chloride, Zinc Copper Manganese & Vitamin C B1 B2 B6 B12 Complex - 1Pack",5.08,2.82,B0DH23CS1J,"Vitalibre 10 in 1 Magnesium Complex, 420mg Elemental Magnesium | Ultra Strength, Max Absorption | Chelated Magnesium Supplement for Sleep, Nerves & Heart Health | Non-GMO, 120 Vegan Capsules",4.44,4.1,2025/8/10
83,laundry detergent,ARM & HAMMER,Tide,GAIN,Health & Personal Care,Biss,Home,B0BSNXFDML,"ARM & HAMMER Plus OxiClean Odor Blasters Fresh Burst, 128 Loads Liquid Laundry Detergent, 166.5 Fl oz",11.14,10.19,B0BSNXN4YX,"ARM & HAMMER Liquid Laundry Detergent, Clean Burst Fresh, 170 fl oz, 170 Loads",4.24,3.82,B085V5PPP8,"Tide Liquid Laundry Detergent, Original, 64 loads, 84 fl oz, HE Compatible (Packaging May Vary)",4.08,4.42,2025/8/10
84,owala water bottle 24 oz,OWALA,,Simple Modern,Kitchen,Outdoors,Guild,B085DV8T75,"Owala FreeSip Insulated Stainless Steel Water Bottle with Straw, BPA-Free Sports Water Bottle, Great for Travel, 24 Oz, Shy Marshmallow",40.18,8.96,B0F2WPH4PF,"Owala Disney Princess FreeSip Insulated Stainless Steel Water Bottle with Straw for Sports and Travel, BPA-Free Sports Water Bottle, 24 oz, Rapunzel",10.52,1.32,B0FDS46BP8,"Owala FreeSip Insulated Stainless Steel Water Bottle with Straw for Sports and Travel, BPA-Free Sports Water Bottle, 24 oz, Crown Jewel",5.68,1.63,2025/8/10
85,liquid iv,LIQUID I.V.,NatureWorks,Venture Pal,Health & Personal Care,Grocery,Pet Products,B0CG7W485N,"Liquid I.V.® Hydration Multiplier - Variety Pack - Lemon Lime, Passion Fruit, Strawberry, Tropical Punch | Electrolyte Powder Drink Mix | 1 Pack (16 Servings)",14.38,9.08,B0CHN5D13P,Liquid I.V.® Hydration Multiplier - Popsicle Firecracker | Electrolyte Powder Drink Mix | 1 Pack (16 Servings),9.04,5.74,B08MVDTLKC,Liquid I.V.® Hydration Multiplier - Strawberry | Electrolyte Powder Drink Mix | 1 Pack (16 Servings),5.51,3.76,2025/8/10
86,press on nails,BTArtbox,Glamnetic,CTTHNBD,Beauty,Luxury_Beauty,Biss,B0DNB1N219,Press on Nails Almond Fake Nails French Tip False Nails with Gold Line Design Glue on Nails Press ons Medium Acrylic Nails Glossy Full Cover Stick on Nails for Women Manicure 24Pcs,7.8,2.67,B0BWPT4SZJ,"Glamnetic Press On Nails - Goal Digger | Glossy, Semi-Transparent, Short Round Nails, Reusable | 12 Sizes - 30 Nail Kit with Glue",4.23,1.57,B0DFLWM1WT,24 Pcs Almond Press on Nails Medium Fake Nails with Glue French Tip False Nails with Brown Leopard Pattern Design Artificial Acrylic Nails Press ons Reusable Almond Nails Glue on Nails for Women,3.19,0.63,2025/8/10
87,ice maker,EUHOMY,COWSAR,Crzoe,Major Appliances,Kitchen,Biss,B0BWHZJHPL,"EUHOMY Countertop Ice Maker Machine with Handle, 26lbs in 24Hrs, 9 Ice Cubes Ready in 6 Mins, Auto-Cleaning Portable Ice Maker with Basket and Scoop, for Home/Kitchen/Camping/RV. (Black)",16.58,14.98,B0FCM4Z8YX,"COWSAR Ice Maker Countertop, Portable Ice Machine with Self-Cleaning, 26.5 lbs/24Hrs, 8 Ice Cubes in 6 Mins, Ice Basket and Scoop, Ideal for Home, Kitchen, Bar, Camping",14.67,14.15,B0F6LGG6ZW,"DUMOS Countertop Ice Maker with Handle, 26lbs/24H Portable Ice Machine, 9 Bullet Ice Cubes Ready in 6 Mins, Self-Cleaning, Quiet Compact Ice Maker for Home, Kitchen, RV, Camping, Black",6.21,6.24,2025/8/10
88,creed,,Creed,WARNER BROS,Digital_Video_Download,Digital_Music_Purchase,Luxury_Beauty,B017WQ0IQU,Creed,46.08,0,B07KPZMT25,Creed II (4K UHD),29.4,0,B0B8TGB4W9,Creed III,11.97,0,2025/8/10
89,curtains,NICETOWN,Joydeco,Nanspring,Home,Sports,Digital_Video_Download,B0BZDLT95R,"Joydeco Blackout Curtains for Bedroom - Natural Linen Curtains 52"" W x 84"" L (Pack of 2), Thermal Insulated 100% Blackout 2 Panels Linen Rod Pocket & Back Tabs Light Blocking Drapes for Living Room",7.84,1.62,B0BWJDW3BX,Cream Linen Back Tab Curtains 84 Inch Length for Living Room 2 Panel Set Neutral Modern Farmhouse Window Privacy Semi Sheer Linen Drapes Rustic Pinch Pleated Look Curtain Natural Ivory Colored,6.39,1.89,B01CS31R94,"NICETOWN Halloween Pitch Black Solid Thermal Insulated Grommet Blackout Curtains/Drapes for Bedroom Window (2 Panels, 42 inches Wide by 63 inches Long, Black)",5.38,1.62,2025/8/10
90,led lights,DAYBETTER,KSIPZE,Tenmiro,Home Improvement,Home,Automotive,B09V366BDY,KSIPZE 100ft Led Strip Lights RGB Music Sync Color Changing Bluetooth Led Lights with Smart App Control Remote Led Lights for Bedroom Room Lighting Flexible Home Décor,19.75,17.35,B0D4DJ6BRR,"DAYBETTER LED Strip Lights 130ft Lights Strip for Bedroom, Desk, Indoor Room Bedroom Brithday Gifts RGB Decor with Remote and 24V Power Supply",8.59,7.22,B0932M1666,"Tenmiro Led Lights for Bedroom 100ft (2 Rolls of 50ft) Music Sync Color Changing Strip Lights with Remote and App Control RGB Strip, for Room Home Party Decoration",6.32,6.63,2025/8/10
91,fan,Dreo,Amazon Basics,HONEYWELL,Home,Home Improvement,Digital_Video_Download,B082MY2MX3,"Amazon Basics Air Circulator Fan, Desk Fan for Bedroom, Home and Office, With 90-Degree Tilt Head, 3 Speed Settings, Lightweight (3 LBS), 35 Watts, Black, 11.1""W x 6.3""D x 10.9""H",10.86,13.04,B09MKPDJRT,"Dreo Tower Fan for Bedroom, 25ft/s Velocity Quiet Floor Fan, 90° Oscillating Fans for Indoors with 4 Speeds, 4 Modes, 8H Timer, Standing Fans, Bladeless Fan, Black, Nomad One (DR-HTF007)",9.49,5.36,B001R1RXUG,"Honeywell Turboforce Fan, Ht-900, 11 inch",9.04,12.92,2025/8/10
92,halloween decorations,LinkCute,AYGXU,JOYIN,Lawn and Garden,Home,Home Improvement,B0FCC1BBTX,Halloween Decorations Outdoor - 5 FT Large Hanging Swing Ghost Halloween Decor with String Lights - Spooky Cute Ghosts Decorations for Front Porch Yard Tree,5.13,1.33,B0D3T94XJN,"2Packs Halloween Decorations Outdoor,Halloweens Party Decoration Indoor,Spooky Ghost with Remote Control String Lights,Halloween-Ghost Lights for Porches Yards Gardens Lawn",4.5,1.16,B0D454ZJKF,"12 PCS Halloween Witch Hats, Black Hanging Witch Hat, Witch Costume Accessories Witches Hat with 328 FT Nylon Cord Wizard Hats Indoor Outdoor Halloween Decorations for Home Yard Porch Ceiling",2.77,2.66,2025/8/10
93,avocado,Fresh Produce,Produce,365 BY WHOLE FOODS MARKET,Fresh_Produce,Fresh_Perishable,Grocery,B000NOGKN4,Medium Hass Avocado,36.57,35.32,B0014GLSE6,Large Organic Hass Avocado,11.95,11.44,B07FYCB4WX,"Organic Bagged Hass Avocados, 4 Count",11.71,10.4,2025/8/10
94,glue sticks,ELMER'S,Amazon Basics,Adtech,Office Products,Biss,Home,B003ULCZ7M,Elmer's Disappearing Purple School Glue Sticks Washable 6 Grams 12 Count,35.88,36.29,B00143SNPG,Elmer's Disappearing Purple School Glue Sticks Washable 22 Grams 3 Count,22.92,21.22,B000VXO4L2,Elmer's Disappearing Purple School Glue Sticks Washable 7 Grams 30 Count,16.45,15.71,2025/8/10
95,dry erase markers,EXPO,Amazon Basics,maxtek,Office Products,Home,Toys,B00006IFIK,EXPO Low Odor Dry Erase Markers Chisel Tip Assorted Colors 4 Count,14.46,15.93,B0004F7GUI,"EXPO Dry Erase Markers, Low Odor Ink, Assorted Colors, Chisel Tip, 12 Count - Easily Erases, Vibrant Ink, Ideal for Classroom, Back to School Supplies, Teachers, Office, Whiteboard & Home",13.95,11.85,B00T3ROM9G,"Amazon Basics Dry Erase Markers For Whiteboards, Chisel Tip, Low-Odor, Assorted Colors, Pack of 12",11.25,9.91,2025/8/10
96,t,,Jozorro,AUDIBLE,Digital_Video_Download,Apparel,Audible,B09NF5WQ5Q,The Summer I Turned Pretty,72,0,B0FG6DHCQN,Last Dance,5.33,0,B0D6XN334B,Twisters,4.67,0,2025/8/10
